<?xml version="1.0" encoding="utf-8" standalone="no"?>
<xs:schema xmlns:xs="http://www.w3.org/2001/XMLSchema" elementFormDefault="qualified">
    <!-- Simple elements -->
    <xs:element name="File" type="xs:string"/>
    <xs:element name="DataFile" type="xs:string"/>
    <xs:element name="Description" type="xs:string"/>
    <xs:element name="Evidence" type="xs:string"/>
    <xs:element name="Rationale" type="xs:string"/>
    <xs:element name="Category" type="xs:string"/>
    <xs:element name="Notes" type="xs:string"/>

    <!-- Attributes types -->
    <xs:simpleType name="ApplyType">
        <xs:restriction base="xs:string">
            <xs:pattern value="replace"/>
            <xs:pattern value="add"/>
            <xs:pattern value="multiply"/>
            <xs:pattern value="([a-zA-Z_][a-zA-Z0-9_]*)+(\.[a-zA-Z_][a-zA-Z0-9_]*)*"/>
        </xs:restriction>
    </xs:simpleType>

    <xs:simpleType name="NumericSequence">
        <!-- Allow fully specified vars as in pkg.mod1.mod2.var -->
        <xs:restriction base="xs:string">
            <!-- handle four variants, plus commas: .12, 12., 1.2, 12, with optional negative signs -->
            <xs:pattern value="-?(\d*\.\d+|\d+\.\d*|\d+)( *, *-?((\d*\.\d+)|(\d+\.\d*)|(\d+)))*"/>
        </xs:restriction>
    </xs:simpleType>

    <!-- Complex elements -->
    <xs:element name='comment'>
        <xs:complexType>
            <xs:sequence>
                <xs:any processContents="skip" minOccurs="0" maxOccurs="unbounded"/>
            </xs:sequence>
        </xs:complexType>
    </xs:element>

    <xs:element name="With">
        <xs:complexType>
            <xs:simpleContent>
                <xs:extension base="xs:decimal">
                    <xs:attribute name="name" use="required" type="xs:string"/>
                </xs:extension>
            </xs:simpleContent>
        </xs:complexType>
    </xs:element>

    <xs:element name="Correlation">
        <xs:complexType>
            <xs:sequence>
                <xs:element ref="With" maxOccurs="unbounded"/>
            </xs:sequence>
        </xs:complexType>
    </xs:element>

    <xs:element name="Binary">
        <xs:complexType>
            <xs:attribute name="prob_of_yes" type="xs:decimal"/>
        </xs:complexType>
    </xs:element>

    <xs:element name="Uniform">
        <xs:complexType>
            <xs:attribute name="min" type="xs:decimal"/>
            <xs:attribute name="max" type="xs:decimal"/>
            <xs:attribute name="range" type="xs:decimal"/>
            <xs:attribute name="factor" type="xs:decimal"/>
            <xs:attribute name="logfactor" type="xs:decimal"/>
        </xs:complexType>
    </xs:element>

    <xs:element name="Integers">
        <xs:complexType>
            <xs:attribute name="min" type="xs:decimal"/>
            <xs:attribute name="max" type="xs:decimal"/>
        </xs:complexType>
    </xs:element>

    <xs:element name="LogUniform">
        <xs:complexType>
            <xs:attribute name="factor" type="xs:decimal"/>
        </xs:complexType>
    </xs:element>

    <xs:element name="Constant">
        <xs:complexType>
            <xs:attribute name="value" type="xs:decimal"/>
        </xs:complexType>
    </xs:element>

    <xs:element name="Sequence">
        <xs:complexType>
            <xs:attribute name="values" type="NumericSequence"/>
        </xs:complexType>
    </xs:element>

    <xs:element name="Grid">
        <xs:complexType>
            <xs:attribute name="min" type="xs:decimal"/>
            <xs:attribute name="max" type="xs:decimal"/>
            <xs:attribute name="count" type="xs:decimal"/>
        </xs:complexType>
    </xs:element>

    <xs:element name="Triangle">
        <xs:complexType>
            <xs:attribute name="min" type="xs:decimal"/>
            <xs:attribute name="max" type="xs:decimal"/>
            <xs:attribute name="mode" type="xs:decimal"/>
            <xs:attribute name="factor" type="xs:decimal"/>
            <xs:attribute name="logfactor" type="xs:decimal"/>
            <xs:attribute name="range" type="xs:decimal"/>
        </xs:complexType>
    </xs:element>

    <xs:element name="Normal">
        <xs:complexType>
            <xs:attribute name="mean" type="xs:decimal"/>
            <xs:attribute name="stdev" type="xs:decimal"/>
            <xs:attribute name="max" type="xs:decimal"/>
            <xs:attribute name="min"  type="xs:decimal"/>
        </xs:complexType>
    </xs:element>

    <xs:element name="Lognormal">
        <xs:complexType>
            <xs:attribute name="log_mean"/>
            <xs:attribute name="log_std"/>
            <xs:attribute name="log_stdev"/>    <!-- alt spelling -->
            <xs:attribute name="norm_mean"/>
            <xs:attribute name="norm_std"/>
            <xs:attribute name="norm_stdev"/>    <!-- alt spelling -->
            <xs:attribute name="low95"/>
            <xs:attribute name="high95"/>
            <xs:attribute name="max" type="xs:decimal"/>
            <xs:attribute name="min"  type="xs:decimal"/>
        </xs:complexType>
    </xs:element>

    <xs:element name="Linked">  <!-- Use values from the named parameter -->
        <xs:complexType>
            <xs:attribute name="parameter"/>
        </xs:complexType>
    </xs:element>

    <xs:element name="Value">
        <xs:complexType mixed="true">
            <xs:attribute name="prob" type="xs:decimal"/>
        </xs:complexType>
    </xs:element>

    <xs:element name="Choice">
        <xs:complexType>
            <xs:sequence>
                <xs:element ref="Value" minOccurs="1" maxOccurs="unbounded"/>
            </xs:sequence>
            <xs:attribute name="min" type="xs:decimal"/>
            <xs:attribute name="max" type="xs:decimal"/>
            <xs:attribute name="count" type="xs:decimal"/>
        </xs:complexType>
    </xs:element>

    <xs:element name="Distribution">
        <xs:complexType>
            <xs:choice>
                <xs:element ref="Constant"/>
                <xs:element ref="Sequence"/>
                <xs:element ref="Binary"/>
                <xs:element ref="Integers"/>
                <xs:element ref="Grid"/>
                <xs:element ref="Lognormal"/>
                <xs:element ref="LogUniform"/>
                <xs:element ref="Normal"/>
                <xs:element ref="Triangle"/>
                <xs:element ref="Uniform"/>
                <xs:element ref="Linked"/>
                <xs:element ref="DataFile"/>
                <xs:element ref="Choice"/>
                <xs:element ref="comment"/>
            </xs:choice>
            <xs:attribute name="apply" type="ApplyType" default="replace"/>
        </xs:complexType>
    </xs:element>

    <xs:element name="Parameter">
        <xs:complexType>
            <xs:all>
                <xs:element ref="Distribution"/>
                <xs:element ref="Correlation" minOccurs="0"/>
                <xs:element ref="comment" minOccurs="0"/>
                <xs:element ref="Category" minOccurs="0"/>
                <xs:element ref="Description" minOccurs="0"/>
                <xs:element ref="Evidence" minOccurs="0"/>
                <xs:element ref="Rationale" minOccurs="0"/>
                <xs:element ref="Notes" minOccurs="0"/>
            </xs:all>
            <xs:attribute name="name" use="required" type="xs:NCName"/>
            <xs:attribute name="active" type="xs:boolean" default="1"/>
        </xs:complexType>
    </xs:element>


    <xs:element name="ParameterList">
        <xs:complexType>
            <xs:choice maxOccurs="unbounded">
                <xs:element ref="Parameter"/>
                <xs:element ref="comment"/>
            </xs:choice>
        </xs:complexType>
    </xs:element>
</xs:schema>
